{
 "id": "telus-digital-ai-community-rater",
 "name": "Part-time online rater / evaluator (TELUS Digital AI Community)",
 "organization": "TELUS Digital AI Community (formerly TELUS International AI)",
 "type": "contract",
 "category": "ai_data",
 "tags": [
  "search-rating",
  "content-evaluation",
  "part-time",
  "canada-residents",
  "qualification-exam"
 ],
 "summary": "TELUS Digital's AI Community hires people living in Canada as part-time freelancers to evaluate search, media and online-safety content from home.",
 "whatYouDo": "Depending on the posting (e.g. Internet Safety Evaluator, Online Data Analyst, Media Search Analyst), you review online content or search results against detailed guidelines and submit ratings. Work is part-time, remote and paid per completed task.",
 "appeal": [
  "Several current-style postings are reserved for Canada residents, including French-language ones",
  "Open-book qualification exam with study materials provided",
  "Part-time and self-paced; some roles have no set hours",
  "Run by the digital arm of a large Canadian company"
 ],
 "watchOuts": [
  "Official estimate for Internet Safety Evaluator is about US$13.50/hr, paid per completed task",
  "Must have lived in Canada 1–5 consecutive years depending on role",
  "Blogs report no-task periods, sudden account 'under review' holds, and pay arriving weeks after the work month",
  "Internet-safety work may involve viewing harmful content (not confirmed in posting snippets)",
  "Freelance agreement: no guaranteed hours or benefits; TELUS told the Globe and Mail hours cannot be guaranteed"
 ],
 "officialUrl": "https://jobs.telusdigital.com/search/cfm5/ai-community/jobs",
 "applyUrl": null,
 "geography": {
  "countries": [
   "CA"
  ],
  "regions": [],
  "canadaEligibility": "likely",
  "setting": "remote"
 },
 "languages": [
  "en"
 ],
 "requirements": {
  "experience": "none",
  "credentialRequired": false,
  "credentials": [],
  "equipment": [
   "computer",
   "fast internet"
  ],
  "minAge": null,
  "assessment": "free_test"
 },
 "schedule": {
  "flexibility": "flexible",
  "windows": [
   "day",
   "evening",
   "night",
   "weekend"
  ],
  "hoursMinWeekly": null,
  "hoursMaxWeekly": null
 },
 "interaction": {
  "modes": [
   "text",
   "independent"
  ],
  "realtime": "none",
  "phone": false
 },
 "skills": {
  "computer": 2,
  "writing": 1,
  "numeracy": 0,
  "detail": 3,
  "customer": 0,
  "technical": 1,
  "creative": 0,
  "language": 2
 },
 "training": {
  "required": true,
  "cost": "free",
  "notes": "Guidelines and learning materials before an open-book qualification exam; language test and ID verification also required."
 },
 "compensation": {
  "min": 13.5,
  "max": null,
  "currency": "USD",
  "unit": "hour",
  "basis": "official",
  "notes": "Internet Safety Evaluator – English (Canada) posting: estimated US$13.50/hr, paid per completed task, potentially more with productivity. Other Canada postings give no rate; one says pay depends on tasks completed and project availability."
 },
 "reliability": {
  "workVolume": "variable",
  "predictability": "low",
  "notes": "Globe and Mail (2023) quoted TELUS saying flexibility means hours cannot be guaranteed; 2026 blogs describe no-task periods. Anecdotal for recent years."
 },
 "workerStatus": "contractor",
 "fees": null,
 "applicationSteps": [
  "Apply to a Canada posting on the TELUS Digital AI Community careers site",
  "Pass the language test",
  "Study the guidelines and pass the open-book qualification exam within the set window",
  "Complete ID verification and onboarding, then start tasks"
 ],
 "timeToFirstEarnings": "unknown",
 "horizon": "now",
 "status": "official_info_found",
 "legitimacy": "established",
 "evidenceStrength": "moderate",
 "riskFlags": [
  "variable_work",
  "contractor_no_benefits",
  "account_deactivation_reports"
 ],
 "fitsIf": "You have lived in Canada for several years, follow detailed rules well, and want low-pressure part-time work from home.",
 "notFitIf": "You need more than about US$13–14/hr or guaranteed weekly hours.",
 "lastChecked": "2026-10-13",
 "sources": [
  {
   "url": "https://jobs.telusdigital.com/search/cfm5/ai-community/jobs",
   "title": "AI Community Careers",
   "type": "official",
   "publisher": "TELUS Digital",
   "published": null,
   "accessed": "2026-10-13",
   "claims": [
    "status",
    "legitimacy"
   ],
   "notes": "Official AI Community job search; Canada filter showed 2–6 jobs across search snapshots. Direct fetch blocked, so live openings not confirmed today.",
   "accessible": false
  },
  {
   "url": "https://jobs.telusdigital.com/jobs/18257907-internet-safety-evaluator-english-canada",
   "title": "Internet Safety Evaluator - English (Canada) in Canada",
   "type": "official",
   "publisher": "TELUS Digital",
   "published": null,
   "accessed": "2026-10-13",
   "claims": [
    "canada_eligibility",
    "pay",
    "requirements",
    "schedule"
   ],
   "notes": "Part-time long-term project; est. US$13.50/hr, task-based; 3 consecutive years Canadian residency; knowledge of Canadian current affairs/social media; broadband and PC with antivirus; language test, open-book exam, ID check.",
   "accessible": false
  },
  {
   "url": "https://jobs.telusdigital.com/jobs/17271746-online-data-analyst-canada",
   "title": "Online Data Analyst - Canada in Canada",
   "type": "official",
   "publisher": "TELUS Digital",
   "published": null,
   "accessed": "2026-10-13",
   "claims": [
    "canada_eligibility",
    "requirements",
    "worker_status"
   ],
   "notes": "Part-time remote freelance role; 5 consecutive years residency; open-book exam within a set timeframe; no pay figure in snippet.",
   "accessible": false
  },
  {
   "url": "https://jobs.telusdigital.com/jobs/18134702-media-search-analyst-english-canada",
   "title": "Media Search Analyst - English (Canada) in Canada",
   "type": "official",
   "publisher": "TELUS Digital",
   "published": null,
   "accessed": "2026-10-13",
   "claims": [
    "canada_eligibility",
    "pay",
    "schedule"
   ],
   "notes": "1 year residency; pay based on tasks completed and project availability; no predetermined hours.",
   "accessible": false
  },
  {
   "url": "https://www.theglobeandmail.com/business/article-ai-data-gig-workers/",
   "title": "Meet the gig workers making AI machines more accurate, capable and powerful",
   "type": "journalism",
   "publisher": "The Globe and Mail",
   "published": "2023-09-16",
   "accessed": "2026-10-13",
   "claims": [
    "reliability",
    "pay",
    "risk"
   ],
   "notes": "Rater profiled earned ~US$14/hr without benefits; TELUS International said flexibility means hours can't be guaranteed. Dated (2023).",
   "accessible": false
  },
  {
   "url": "https://www.aitrainingjobsfinder.com/blog/telus-international-ai-review-2026",
   "title": "telus international ai review 2026",
   "type": "independent_review",
   "publisher": "AI Training Jobs Finder",
   "published": null,
   "accessed": "2026-10-13",
   "claims": [
    "reliability",
    "risk"
   ],
   "notes": "One of several affiliate-style 2026 reviews that together report inconsistent task availability, 'under review' holds and monthly pay lag; individual claims not separable by site in search output.",
   "accessible": false
  },
  {
   "url": "https://breakingeven.online/blog/telus-ai-review",
   "title": "telus ai review",
   "type": "independent_review",
   "publisher": "BreakingEven",
   "published": null,
   "accessed": "2026-10-13",
   "claims": [
    "reliability",
    "risk"
   ],
   "notes": "Blog review describing no-task periods tied to paused client batches. Anecdotal.",
   "accessible": false
  }
 ]
}
