{
 "id": "languageline-indigenous-language-interpreter-canada",
 "name": "Over-the-phone interpreter (Indigenous languages, Canada)",
 "organization": "LanguageLine Solutions",
 "type": "contract",
 "category": "language_writing",
 "tags": [
  "interpreting",
  "phone",
  "indigenous-languages",
  "cree",
  "inuktitut",
  "bilingual",
  "work-from-home"
 ],
 "summary": "Work-from-home phone interpreting between English and Indigenous languages such as Cree or Inuktitut for LanguageLine, as an independent contractor paid per call minute.",
 "whatYouDo": "From a quiet home workspace you interpret live phone calls between English speakers and people who speak Cree, Inuktitut or another Indigenous language. You are paid only for the minutes you spend on interpreted calls.",
 "appeal": [
  "LanguageLine postings explicitly for work-from-home roles in Canada",
  "Rewards a scarce skill: fluency in Cree, Inuktitut or other Indigenous languages",
  "Postings list $1.25–$1.40 per call minute",
  "Large, established interpreting company"
 ],
 "watchOuts": [
  "Independent contractor, not eligible for employee benefits (per posting)",
  "Paid only for active call minutes; reviews report low per-minute pay and periods of low call volume with long unpaid waits",
  "Rates vary by time of day and interpretation level",
  "Must provide a quiet, secure environment",
  "French interpreter postings found were US-only; Canadian postings found were for Indigenous languages",
  "Postings were not opened directly; current openings unconfirmed"
 ],
 "officialUrl": "https://languageline.wd5.myworkdayjobs.com/LLS_Careers/job/Canada-Remote/Inuktitut-Interpreter-in-Canada_R5501",
 "applyUrl": null,
 "geography": {
  "countries": [
   "CA"
  ],
  "regions": [],
  "canadaEligibility": "likely",
  "setting": "remote"
 },
 "languages": [
  "en",
  "cr",
  "iu"
 ],
 "requirements": {
  "experience": "some",
  "credentialRequired": false,
  "credentials": [],
  "equipment": [
   "quiet space"
  ],
  "minAge": null,
  "assessment": "unknown"
 },
 "schedule": {
  "flexibility": "varies",
  "windows": [
   "day",
   "evening",
   "night",
   "weekend"
  ],
  "hoursMinWeekly": null,
  "hoursMaxWeekly": null
 },
 "interaction": {
  "modes": [
   "voice"
  ],
  "realtime": "high",
  "phone": true
 },
 "skills": {
  "computer": 1,
  "writing": 0,
  "numeracy": 0,
  "detail": 2,
  "customer": 2,
  "technical": 0,
  "creative": 0,
  "language": 3
 },
 "training": {
  "required": false,
  "cost": "unknown",
  "notes": "Training and screening requirements not stated in sources found."
 },
 "compensation": {
  "min": 1.25,
  "max": 1.4,
  "currency": "unstated",
  "unit": "minute_audio",
  "basis": "aggregator",
  "notes": "Per minute of interpreted call time, from aggregator copies (Glassdoor, Remotive) of LanguageLine's Canada postings; currency not shown in indexed text; one copy labels the header 'per hour' but per-minute is consistent across listings. Waiting time between calls is unpaid."
 },
 "reliability": {
  "workVolume": "variable",
  "predictability": "low",
  "notes": "Glassdoor interpreter reviews (2016–2026, mostly US) are mixed: some report high volume, others falling volume and long waits between short calls. No Canada-specific volume data."
 },
 "workerStatus": "contractor",
 "fees": null,
 "applicationSteps": [
  "Find the Canada work-from-home interpreter posting for your language on LanguageLine's Workday careers site",
  "Apply online",
  "Complete LanguageLine's screening (details not published in sources found)",
  "Set up a quiet, secure home workspace before taking calls"
 ],
 "timeToFirstEarnings": "unknown",
 "horizon": "now",
 "status": "official_info_found",
 "legitimacy": "established",
 "evidenceStrength": "moderate",
 "riskFlags": [
  "contractor_no_benefits",
  "variable_work",
  "phone_heavy"
 ],
 "fitsIf": "You are fluent in English and an Indigenous language such as Cree or Inuktitut and are comfortable interpreting live calls from home.",
 "notFitIf": "You need steady, benefits-eligible hours or are uncomfortable with fast, high-pressure live phone conversations.",
 "lastChecked": "2026-10-13",
 "sources": [
  {
   "url": "https://languageline.wd5.myworkdayjobs.com/LLS_Careers/job/Canada-Remote/Inuktitut-Interpreter-in-Canada_R5501",
   "title": "Inuktitut Interpreter in Canada",
   "type": "official",
   "publisher": "LanguageLine Solutions",
   "published": null,
   "accessed": "2026-10-13",
   "claims": [
    "canada_eligibility",
    "worker_status"
   ],
   "notes": "Official Workday posting under 'Canada-Remote' (seen in search results; not opened). Search summaries: independent contractor position, not eligible for employee benefits.",
   "accessible": false
  },
  {
   "url": "https://languageline.wd5.myworkdayjobs.com/en-US/LLS_Careers/job/Cree-Interpreter-in-Canada_R5500",
   "title": "Cree Interpreter in Canada",
   "type": "official",
   "publisher": "LanguageLine Solutions",
   "published": null,
   "accessed": "2026-10-13",
   "claims": [
    "canada_eligibility"
   ],
   "notes": "Official Workday posting for a Cree interpreter in Canada (seen in search results; not opened).",
   "accessible": false
  },
  {
   "url": "https://www.glassdoor.ca/job-listing/cree-interpreter-languageline-solutions-JV_KO0,16_KE17,39.htm?jl=1007975669112",
   "title": "LanguageLine Solutions hiring Cree Interpreter Job in Remote",
   "type": "aggregator",
   "publisher": "Glassdoor",
   "published": null,
   "accessed": "2026-10-13",
   "claims": [
    "pay",
    "schedule"
   ],
   "notes": "Copy of posting: work-from-home phone interpreter in Canada, $1.25–$1.40 per minute; rates depend on time of day/night and interpretation level.",
   "accessible": false
  },
  {
   "url": "https://remotive.com/remote/jobs/all-others/inuktitut-interpreter-4635951",
   "title": "Inuktitut Interpreter @LanguageLine Solutions",
   "type": "aggregator",
   "publisher": "Remotive",
   "published": null,
   "accessed": "2026-10-13",
   "claims": [
    "pay",
    "worker_status"
   ],
   "notes": "Copy of posting: $1.25–$1.40 per minute; independent contractor, not eligible for employee benefits.",
   "accessible": false
  },
  {
   "url": "https://www.glassdoor.es/Opiniones/Opinión-empleado-LanguageLine-Solutions-E354434-RVW92505986.htm",
   "title": "Low pay, low call volume (LanguageLine interpreter review)",
   "type": "forum",
   "publisher": "Glassdoor",
   "published": null,
   "accessed": "2026-10-13",
   "claims": [
    "reliability",
    "risk"
   ],
   "notes": "Anonymous interpreter reviews (2016–2026, mostly US): low per-minute pay, variable call volume, unpaid waits; others praise remote flexibility and prompt pay. Anecdotal.",
   "accessible": false
  },
  {
   "url": "https://remotive.com/remote/jobs/customer-service/french-interpreter-4298531",
   "title": "[Hiring] French Interpreter @LanguageLine Solutions",
   "type": "aggregator",
   "publisher": "Remotive",
   "published": null,
   "accessed": "2026-10-13",
   "claims": [
    "canada_eligibility"
   ],
   "notes": "French interpreter postings found were restricted to the United States (one listed $18–$21/hour), so French is not evidenced as a Canada route here.",
   "accessible": false
  }
 ],
 "audience": [
  "People fluent in English and an Indigenous language such as Cree or Inuktitut"
 ]
}
