{
 "id": "canva-creators-template-designer",
 "name": "Canva template creator",
 "organization": "Canva",
 "type": "freelance",
 "category": "creative_production",
 "tags": [
  "templates",
  "graphic-design",
  "royalties",
  "portfolio-required",
  "beta-program",
  "side-income"
 ],
 "summary": "Design templates for Canva's library and earn monthly royalties based on how often Canva users use them. You get in through a portfolio application, and the program is listed as being in beta.",
 "whatYouDo": "Once accepted, you design customizable templates (social posts, presentations, flyers and so on) to Canva's baseline requirements and submit them for review. Approved templates go into Canva's library, and you're paid from a monthly royalty pool according to how much your templates are used.",
 "appeal": [
  "Free to apply, and you design in Canva itself",
  "Paid on usage of both Free and Pro templates, from a royalty pool that grows with Canva's subscription revenue",
  "Payouts via PayPal, Payoneer or Skrill",
  "Work entirely on your own schedule"
 ],
 "watchOuts": [
  "You must apply with a portfolio and be accepted. Canva says the template creator program is in beta",
  "Applications to become an element creator are paused (Canva creators page)",
  "Canva says it may take up to a couple of months to be signed on (education creator page)",
  "There is no official earnings range. Third-party blog claims of $50–$500+ a month are unverified",
  "Income depends on usage within a very large library, so it's unpredictable",
  "Sources found don't say which countries can join as a creator"
 ],
 "officialUrl": "https://www.canva.com/creators/templates/",
 "applyUrl": null,
 "geography": {
  "countries": [],
  "regions": [],
  "canadaEligibility": "unclear",
  "setting": "remote"
 },
 "languages": [
  "en"
 ],
 "requirements": {
  "experience": "some",
  "credentialRequired": false,
  "credentials": [],
  "equipment": [
   "computer",
   "fast internet"
  ],
  "minAge": null,
  "assessment": "unknown"
 },
 "schedule": {
  "flexibility": "flexible",
  "windows": [
   "day",
   "evening",
   "night",
   "weekend"
  ],
  "hoursMinWeekly": null,
  "hoursMaxWeekly": null
 },
 "interaction": {
  "modes": [
   "independent"
  ],
  "realtime": "none",
  "phone": false
 },
 "skills": {
  "computer": 2,
  "writing": 1,
  "numeracy": 0,
  "detail": 2,
  "customer": 0,
  "technical": 1,
  "creative": 3,
  "language": 1
 },
 "training": {
  "required": false,
  "cost": "none",
  "notes": "Review guidelines are provided after acceptance. An older blog says applicants once had to pass a design challenge (may be outdated)."
 },
 "compensation": {
  "min": null,
  "max": null,
  "currency": null,
  "unit": null,
  "basis": "unknown",
  "notes": "Official: monthly royalty pool shared by template usage (downloads, prints, presentations) of Free and Pro templates; paid on or before the 15th once a payout threshold is reached (one blog says $10 USD, unverified). No official earnings figures. Canva separately announced (2023) a $200M fund for creators who opt in to AI training use."
 },
 "reliability": {
  "workVolume": "sporadic",
  "predictability": "low",
  "notes": "Royalties depend on how often users pick your templates; no worker reports on typical earnings were found."
 },
 "workerStatus": "contractor",
 "fees": null,
 "applicationSteps": [
  "Build a portfolio of templates designed to be customized",
  "Apply to the Canva Creators template program with your portfolio",
  "If accepted, follow the baseline requirements and review guidelines and submit templates",
  "Set up PayPal, Payoneer or Skrill to receive monthly royalties"
 ],
 "timeToFirstEarnings": "months",
 "horizon": "bridge",
 "status": "official_info_found",
 "legitimacy": "established",
 "evidenceStrength": "weak",
 "riskFlags": [
  "variable_work",
  "waitlist"
 ],
 "fitsIf": "You design clean, reusable layouts and want a low-pressure creative side income built up over time.",
 "notFitIf": "You need income soon or a clear idea of what you'll earn.",
 "lastChecked": "2026-10-13",
 "sources": [
  {
   "url": "https://www.canva.com/creators/templates/",
   "title": "Canva Creators: templates",
   "type": "official",
   "publisher": "Canva",
   "published": null,
   "accessed": "2026-10-13",
   "claims": [
    "requirements",
    "status",
    "pay"
   ],
   "notes": "Search summary: template creators must apply and be accepted by sharing a design portfolio; program in BETA taking early applications; templates must meet baseline requirements; payouts via PayPal, Payoneer or Skrill (payout options not pinned precisely). Page not opened.",
   "accessible": false
  },
  {
   "url": "https://www.canva.com/help/canva-creators-program/",
   "title": "Canva Creators program (help centre)",
   "type": "official",
   "publisher": "Canva",
   "published": null,
   "accessed": "2026-10-13",
   "claims": [
    "pay"
   ],
   "notes": "Search summary: earnings come from a royalty pool based on template usage (download, print or present), for both Free and Pro templates; pool grows with subscription revenue and is calculated monthly; templates available to users in 190 countries. Page not opened.",
   "accessible": false
  },
  {
   "url": "https://www.canva.com/help/contributor-application/",
   "title": "Canva contributor application (help centre)",
   "type": "official",
   "publisher": "Canva",
   "published": null,
   "accessed": "2026-10-13",
   "claims": [
    "requirements"
   ],
   "notes": "Official help page on applying as a creator, seen in results; no country eligibility found. Page not opened.",
   "accessible": false
  },
  {
   "url": "https://www.canva.com/da_dk/creators/",
   "title": "Canva Creators (Danish)",
   "type": "official",
   "publisher": "Canva",
   "published": null,
   "accessed": "2026-10-13",
   "claims": [
    "status"
   ],
   "notes": "Search summary (translated from Danish): template creators apply with a portfolio; the element-creator application is currently paused. Page not opened.",
   "accessible": false
  },
  {
   "url": "https://www.canva.com/education/education-creator/",
   "title": "Canva education creator",
   "type": "official",
   "publisher": "Canva",
   "published": null,
   "accessed": "2026-10-13",
   "claims": [
    "status"
   ],
   "notes": "Search summary: says it may take up to a couple of months to be signed on as a creator. Page not opened.",
   "accessible": false
  },
  {
   "url": "https://www.krea.ai/blog/can-you-make-money-with-canva-creators-program-and-etsy-templates-in-2026",
   "title": "Can you make money with Canva Creators program and Etsy templates in 2026",
   "type": "aggregator",
   "publisher": "Krea (blog)",
   "published": null,
   "accessed": "2026-10-13",
   "claims": [
    "pay"
   ],
   "notes": "Third-party blog. The search summary attributed unverified claims of $50–$500+ monthly royalties and a $10 USD payout threshold to blog sources (not pinned precisely to this page). Treat as unverified. Page not opened.",
   "accessible": false
  },
  {
   "url": "https://www.startupdaily.net/topic/artificial-intelligence-machine-learning/canva-earmarks-200-million-in-royalty-payments-for-new-ai-platform/",
   "title": "Canva earmarks $200 million in royalty payments for new AI platform",
   "type": "journalism",
   "publisher": "Startup Daily",
   "published": null,
   "accessed": "2026-10-13",
   "claims": [
    "pay"
   ],
   "notes": "2023 report: Canva set aside $200M over three years for creators who opt in to having their content used for AI training; separate from template royalties. Page not opened.",
   "accessible": false
  }
 ]
}
